<?xml version="1.0"?>
<xs:schema xmlns:xs="http://www.w3.org/2001/XMLSchema">
    <!--Hayley Dodkins u21528790-->

    <xs:element name="users">
        <xs:complexType>
            <xs:sequence>
                <!--Define the node element-->
                <xs:element name="user" maxOccurs="unbounded">
                    <xs:complexType>
                        <xs:sequence>
                            <xs:element name="id" type="xs:string"/>
                            <xs:element name="username" type="xs:string"/>
                            <xs:element name="password" type="xs:string"/>
                            <xs:element name="role" type="xs:string"/>
                        </xs:sequence>
                        <xs:attribute name="storeId" type="xs:string" use="optional"/>
                    </xs:complexType>
                </xs:element>

            </xs:sequence>
        </xs:complexType>
    </xs:element>
</xs:schema>